rank,entity,count,doc_freq,ent_type,std_name,role,topic,nonambiguous,informative,notes,example
1,court,1784,96,ORG,Court,ACTOR,,1,informative,,"See following observations of Justice Krishna Iyer speaking for this Court in Hira Lal Malik v. State : ""When a crime is committed by the concerted action of a plurality of persons constructive liability implicates each participant, but the"
2,high court,1273,91,ORG,High Court,ACTOR,,1,informative,,"The High Court in appeal set aside the conviction (sic) Singh, Ajaib Singh and Satinderpal Singh."
3,state,899,51,ORG,State,ACTOR,,1,informative,,"We have, therefore, ourselves looked into the record and heard the learned counsels appearing for the State and the accused."
4,india,506,48,GPE,India,EVIDENCE,,1,informative,,"(1) , this court in the backdrop of interpretation of various relevant provisions of the Code of Criminal Procedure (for short, Cr.P.C.) under Chapter XIV and of the principles of law enunciated by this court in a series of decisions relati"
5,constitution,486,38,LAW,Constitution,RULE,CONSTITUTIONAL,1,informative,,"At present, the industry is in the penumbral region where the commodity is free to be distributed at the manufacturer's choice, but yet where such manufacturer being a State instrumentality, has to conform to Articles 14 and 19 of the Const"
6,act,448,59,WORK_OF_ART,Act,,,1,informative,,(6) Where there is an express legal bar engrafted in any of the provisions of the Code or the concerned Act (under which a criminal proceeding is instituted) to the institution and continuance of the proceedings and/or where there is a spec
7,state government,270,29,ORG,State Government,ACTOR,,1,informative,,"Under the above provision, the Board is under a statutory obligation to carry on its operations and adjust its tariffs in such a way to ensure that the total revenues earned in any year of account shall, after meeting all expenses chargeabl"
8,union of india,207,24,ORG,Union Of India,ACTOR,,1,informative,,"premier Automobiles v. Union, [1972] 2 S.C.R. 526; Panipat Cooperative Sugar Mills v. Union, [1973] Oil And Natural Gas Commission And vs Association Of Natural Gas Consuming ... on 4 May, 1990 2 S.C.R. 860; Shree Meenakshi Mills v. Union, "
9,tribunal,200,14,ORG,Tribunal,ACTOR,,1,informative,,"It is of interest that in the second case, dealing with the question whether interest cannot be taken into account in working out profits, the Court observed, ( p. 235, para 5): 'The facile assumption by the Tribunal that the interest shoul"
10,indian,174,35,NORP,Indian,ACTOR,,1,informative,,This appeal is also directed against the acquittal of other convicted co-accused for offences under Sections 148 and 149 of Indian Panel Code (For short I.P.C.).
11,singh,165,33,GPE,Singh,EVIDENCE,,1,informative,,Harjit Singh
12,ongc,145,2,ORG,Ongc,ACTOR,,1,informative,,"Aggrieved by the steady rise in the prices, the respondents Association of Natural Gas Consuming Industries and Others--moved the Bombay High Court in March 1979 by way of a writ petitionIn the petition it was, inter alia, prayed that the O"
13,assessee,133,7,GPE,Assessee,EVIDENCE,,1,informative,,"The assessee utilised these goods in the manufacture of finished products and sold the same in the market and the sale proceeds received by the assessee were credited in the trading account maintained in the books account of the business, s"
14,art,132,18,PRODUCT,Art,,,0,non-informative,,Petition under Art.
15,nos,131,35,PERSON,Nos,,,0,non-informative,,"(sic) preferred by the convicted accused Harjit Singh, Varinderjit Singh and Gursharan Singh hereinafter they shall be described as accused Nos. 1, 2 & 6 being the order in which they were arraigned before the trial court."
16,parliament,124,15,ORG,Parliament,ACTOR,,1,informative,,"But Parliament generally provides for interference only at a stage where in pursuance of social and economic objectives or to discharge duties under the Directive Principles of State Policy, control has to be exercised over the distribution"
17,supreme court,122,31,ORG,Supreme Court,ACTOR,,1,informative,,"3 0 4 0 , 2 0 0 2 ( 2 ) A L D ( C R I ) 4 2 0 , 2002(1)ALT(CRI)227, 2002(3)CRIMES158(SC), )SC123, , , [2002]SUPP1SCR581, SUPREME COURT 3040, , 2002 SCW 3393, (2002) 2"
18,district magistrate,121,7,ORG,District Magistrate,ACTOR,,1,informative,,"therefore, filed an application on 7-11-1961 before the Rent Control and Eviction Officer (Rent Controller) with a copy to the District Magistrate, Kanpur under Rule 6 of the Control of Rent and Eviction Rules, 1949framed under Section 17 o"
19,ipc,118,11,ORG,Ipc,ACTOR,,1,informative,,"Additional sessions Judge, Amritsar in Sessions Trial No. 1/95 convicted all the six accused for offences under Sections 302, 307, 323, 324, 326 read with Sections 148 & 149 IPC and sentenced them all to life imprisonment and separate sente"
20,union of india &,118,8,ORG,Union Of India &,ACTOR,,1,informative,,This Court in K.M. Abdulla Kunhi & B.L. Abdul Khader vs. Union of India & and State of Karnataka & (CB) has clearly held that the authority has no constitutional duty to consider the representation made by the detenu before the order of con
21,chunilal,112,1,PERSON,Chunilal,ACTOR,,1,informative,,"On 3-11-1953, another agreement was entered into between the Liquidators and Chunilal Khushaldas Patel, hereinafter referred to as Chunilal, incorporating therein the terms of Clauses (5) and (6) set out above and Chunilal agreed to abide b"
22,central government,107,16,ORG,Central Government,ACTOR,,1,informative,,"Functions of the Commission-- (1) Subject to the provisions of this Act, the functions of the Commission shall generally be to plan, promote, organise and implement programmes for the development of petroleum resources and the production an"
23,a.p,102,7,ORG,A.P,ACTOR,,1,informative,,"Madhavkrishna and v. Chandra Bhaga and , [1997] 2 ; Konda Lakshmana Bapuji v. Government of A.P. and ,"
24,trial court,101,14,ORG,Trial Court,ACTOR,,1,informative,,The Trial Court framed necessary issues on the basis of pleadings of the parties and held that Hiralal was absolute and full owner of the property and he had right to sell it to the plaintiff.
25,smt,92,19,ORG,Smt,ACTOR,,1,informative,,Paragraph 28 refers to the claim of Smt.
26,division bench,87,13,ORG,Division Bench,ACTOR,,1,informative,,"Against the order of the Single Judge, an appeal was preferred to Division Bench and it reversed the finding of the Single Judge."
27,commission,87,9,ORG,Commission,ACTOR,,1,informative,,Chapter III which deals with the powers and functions of the Commission consists of Sections 14 and 15.
28,state of bihar,86,10,FAC,State Of Bihar,EVIDENCE,,1,informative,,"Hari Sao And vs State Of Bihar on 15 October, 1969 COURT 843, , 1970 MADLW (CRI) 186, 1970 MADLW (CRI) 146, 1970 SCD 233,"
29,chebrolu leela,85,1,ORG,Chebrolu Leela,ACTOR,,1,informative,,Chebrolu Leela Prasad Rao vs State Of A.P. .
30,hindu,84,13,NORP,Hindu,ACTOR,,1,informative,,"Respondent no.2 visited Ranchi to participate in ""Gangaur"" festival (an important Hindu festival widely celebrated in Northern India) on 16.3.2007."
31,board,81,15,ORG,Board,ACTOR,,1,informative,,It is not the function of the Board to so manage its affairs as to earn the maximum profit; even as a private corporate body may be inspired to earn huge profits with a view to paying large dividends to its shareholders.
32,crpc,81,5,ORG,Crpc,ACTOR,,1,informative,,The High Court passed the order on a revision application under Section 489 of the CrPC made by Harmit Kaur widow of the deceased Bharpur Singh.
33,collector,79,7,ORG,Collector,ACTOR,,1,informative,,(3) If any person refuses or fails to pay the arrears of rent or any instalments thereof payable under sub-section (1) or the damages or any instalment thereof payable under sub-section (2) within the time specified in the order relating th
34,kknpp,75,1,ORG,Kknpp,ACTOR,,1,informative,,for setting up of KKNPP at Kudankulam in view of the Indo-Russia agreement.
35,mahajan deolal,72,1,PERSON,Mahajan Deolal,ACTOR,,1,informative,,"133 (1) (a) of the Constitution, The appellant is Mithoolal Nayak, who took an assignment on october 18, 1945 of a life insurance policy on the life of one Mahajan Deolal for a sum of Rs."
36,cec,71,2,ORG,Cec,ACTOR,,1,informative,,The CEC was originally directed to be constituted by an order of this Court dated 09.05.2002.2
37,m. s. murthy,71,1,PERSON,M. S. Murthy,ACTOR,,1,informative,,"M/S. Trinity Infraventures Ltd. vs M. S. Murthy on 15 June, 2023"
38,hydernagar,71,1,GPE,Hydernagar,EVIDENCE,,1,informative,,38 Hydernagar patta Hydernagar Taluk lands.
39,government of india,70,18,ORG,Government Of India,ACTOR,,1,informative,,"We direct the Registry to send a copy of this judgment to the Law Commission and to the Union Law Secretary, Government of India who may place it before the Hon'ble Minister for Law & Justice to take appropriate steps in the larger interest"
40,sec,69,10,ORG,Sec,,,0,non-informative,,The proviso to sec. 14(1)(e) of the Act which lays down that the setting up of industries to be run with the aid of gas was not to be undertaken by the ONGC without the Central Government's approval also gives an indication that the supply 
41,committee,68,15,ORG,Committee,ACTOR,,1,informative,,"In that sense, cl. 14 which confers on the Trustees absolute discretion to deal with the property in any manner they like, as well as cls. 18 and 24 which clothe them with authority to employ servants is their uncontrolled discretion and to"
42,npcil,68,1,ORG,Npcil,ACTOR,,1,informative,,"Following that, a separate public sector company, namely, the Nuclear Power Corporation of India G.Sundarrajan vs Union Of India & on 6 May, 2013 (NPCIL) with a view to design, build and operate nuclear reactors in the country was created i"
43,article 16(4,67,1,LAW,Article 16(4,,,0,non-informative,,(3) Whether the notification merely contemplates a classification under Article 16(1) and not reservation under Article 16(4)?
44,sheth,66,1,PERSON,Sheth,ACTOR,,1,informative,,Union Of India (Uoi) vs Sankalchand Himatlal Sheth
45,article 222,66,1,LAW,Article 222,RULE,CONSTITUTIONAL,1,informative,,"The order was purported to be made by the President in exercise of the powers conferred under Article 222, Clause (1) of the Constitution."
46,sc,65,32,GPE,Sc,,,0,non-informative,,"CGLJ 424, 2002 CRILR(SC&MP) 791, 2002 (4) SLT 777, (SC), , 2002 (8) SRJ 368, , 2002 (CRI) 1518, (2002) 1 MADLW(CRI) 306, (2002) MAD LJ(CRI) 490, (2002) 3 CRIMES 158, 2003 CHANDLR(CIV&CRI) 584, (2002) 3 ALLCRIR 2557, (2002) 3 JLJR 161, (2002"
47,crl,65,13,ORG,Crl,ACTOR,,1,informative,,"47 ALLCRIC 388, (2003) 1 ALLCRILR 241, 2002 (2) (CRL) 420 Bench: N. Santosh Hegde, D.M. Dharmadhikari JUDGMENT Dharmadhikari, J. 1."
48,lakshmanan,65,2,ORG,Lakshmanan,ACTOR,,1,informative,,"because, according to the evidence of one Dr. P.N Lakshmanan, Consulting Physician at Jabalpur, Mahajan Deolal was examined and treated by the said doctor between the dates September 7, 1943, and October 6, 1943, when the doctor found that "
49,icai,65,1,ORG,Icai,ACTOR,,1,informative,,"The petition before the High Court Centre For Public Interest Litigation vs U.O.I on 23 February, 2018 sought direction for exercise of power under Section 21 of the Chartered Accountants Act, 1949 (‘CA Act’) to initiate investigation again"
50,punjab,64,20,GPE,Punjab,EVIDENCE,,1,informative,,"And vs State Of Punjab on 16 August, 2002 Criminal Appeal No. 814 of 2001 State of Punjab v. Harjit Singh."
51,state of m.p. &,63,2,ORG,State Of M.P. &,ACTOR,,1,informative,,"Narmada Bachao Andolan vs State Of M.P. & on 11 May, SC (CIVIL) 1523, , , 2011 (3) SN 139 (SC) Author: B. S. Chauhan Bench:"
52,k.s. setlur,63,1,PERSON,K.S. Setlur,ACTOR,,1,informative,,"The suit was instituted by Iyengar Krishnamurthy S. Setlur Dead By Lrs vs O. V. Narasimha Setty & on 23 February, 2007 against K.S. Setlur and Shyamala Raju stating that they had unauthorisedly disturbed his possession."
53,english,62,22,LANGUAGE,English,,,1,informative,,The English courts have also used inherent power to achieve the same objective.
54,kanpur,62,8,GPE,Kanpur,EVIDENCE,,1,informative,,The Complainant Manisha was married to Kamal Poddar at Kanpur on 10.12.2006.
55,adhyaru,62,1,PERSON,Adhyaru,ACTOR,,1,informative,,"They tried to induce Harshad kumar K. Adhyaru, hereinafter referred to as Adhyaru, to purchase these 1936 shares."
56,gujarat,61,16,GPE,Gujarat,EVIDENCE,,1,informative,,"This appeal has been filed by Preeti Gupta the married sister-in-law and a permanent resident of Navasari, Surat, Gujarat with her husband and Gaurav Poddar, a permanent resident of Goregaon, Maharashtra, who is the unmarried brother-in-law"
57,bank,61,10,ORG,Bank,ACTOR,,1,informative,,"He, however, stated that, without prejudice to the rights of the Liquidators and subject to the approval by Dave and subject to the sanction of the District Judge, he was sending the cheque for Rs. 9,68,000/- drawn by Chunilal in favour of "
58,p.c,61,8,GPE,P.C,EVIDENCE,,1,informative,,The defence of accused Harjit Singh A1 as contained in his statement recorded under Section 313 Cr.P.C. is as under: He accepts his presence on the date and time of the incident.
59,narmada bachao andolan,60,2,PERSON,Narmada Bachao Andolan,ACTOR,,1,informative,,"Narmada Bachao Andolan vs State Of M.P. & on 11 May, SC (CIVIL) 1523, , , 2011 (3) SN 139 (SC) Author: B. S. Chauhan Bench:"
60,nizam,59,2,PERSON,Nizam,ACTOR,,1,informative,,"The appellants were appointed trustees by the Nizam of Hyderabad by a trust deed executed on Tune 14, 1951."
61,sankalchand himatlal,58,1,PERSON,Sankalchand Himatlal,ACTOR,,1,informative,,Union Of India (Uoi) vs Sankalchand Himatlal Sheth
62,delhi,57,11,GPE,Delhi,EVIDENCE,,1,informative,,"Appeal by special leave from the judgment and order dated February 22, 1962 of the Punjab High Court (Circuit Bench) at Delhi in Civil Revision No. 311-D of 1958."
63,chandigarh,57,7,GPE,Chandigarh,EVIDENCE,,1,informative,,"Appeal (civil)#Appeal (civil) 4051 of 1996#1996#M/s Pepsi Foods Limited #Collector of Central Excise, Chandigarh #2003-11-25#25622#4051#P. VENKATARAMA REDDI#Dr."
64,fir,56,7,ORG,Fir,ACTOR,CRIMINAL,1,informative,,"(2) Where the allegations in the first information report and other materials, if any, accompanying the FIR do not disclose a cognizable offence, justifying an investigation by police officers under Section 156(1) of the Code except under a"
65,appellate tribunal,56,5,ORG,Appellate Tribunal,ACTOR,,1,informative,,"At the hearing of the appeal before the Income-tax Appellate Tribunal, Anusuya Devi-widow of Amritlal-filed an affidavit in which it was stated, inter alia 5."
66,hiralal,56,1,PERSON,Hiralal,ACTOR,,1,informative,,In the said deed it was expressly mentioned that Hiralal was the absolute owner of the property and he had full rights to sell the house.
67,new delhi,55,34,GPE,New Delhi,EVIDENCE,,1,informative,,"J. (K.S. Radhakrishnan) New Delhi; August 13, 2010 Preeti Gupta & vs State Of Jharkhand & on 13 August, 2010"
68,oil and natural gas commission,55,1,ORG,Oil And Natural Gas Commission,ACTOR,,1,informative,,"Oil And Natural Gas Commission And vs Association Of Natural Gas Consuming ... on 4 May, 1990 COURT 1851, 1991 SCW 1900, 1990 (SUPP) 397, (2001) 2 UC 270, (1990) 2 COMLJ 89, (SC) Bench: N.D. Ojha, Jagdish Saran Verma OIL AND NATURAL GAS COM"
69,padmasani,55,1,PERSON,Padmasani,ACTOR,,1,informative,,"She was survived by her daughter Padmasani, who was married to Rajagopala Iyengar (P. W. 1)."
70,bench,53,30,PERSON,Bench,ACTOR,,1,informative,,"In Madhu Limaye v. The State of Maharashtra , a three-Judge Bench of this court held as under:- ""....."
71,state commission,53,5,ORG,State Commission,ACTOR,,1,informative,,The Bank preferred an appeal to the State Commission.
72,chief justice of india,53,3,ORG,Chief Justice Of India,ACTOR,,1,informative,,"Under cl (4) where such directions are given and ""costs have been incurred in excess of those which would have been incurred in the discharge of the normal duties of the State if such direction had not been given,"" the Government of India m"
73,s. 42,53,1,PERSON,S. 42,ACTOR,,1,informative,,"Respondent No. 2 to whom these plots had been given on repartition moved the State Government under s. 42 to revise the order made by Shri Brar, and the State Government set aside the order of Shri Brar and restored that of the Consolidatio"
74,state of tamil nadu,52,8,ORG,State Of Tamil Nadu,ACTOR,,1,informative,,"In support of his contention, he very much relied on the recent decision of this Court in Rekha vs. State of Tamil Nadu ."
75,magistrate,51,13,ORG,Magistrate,ACTOR,,1,informative,,"(2) Where the allegations in the first information report and other materials, if any, accompanying the FIR do not disclose a cognizable offence, justifying an investigation by police officers under Section 156(1) of the Code except under a"
76,civil)#appeal,51,1,ORG,Civil)#Appeal,,,0,non-informative,,"Appeal (civil)#Appeal (civil) 4051 of 1996#1996#M/s Pepsi Foods Limited #Collector of Central Excise, Chandigarh #2003-11-25#25622#4051#P. VENKATARAMA REDDI#Dr."
77,institute,51,1,ORG,Institute,ACTOR,,1,informative,,It was noted that some of the MAFs are active in India and are rendering services which are provided by CAs without registration with the Institute.
78,section 7 of the code,51,1,LAW,Section 7 Of The Code,RULE,,1,informative,,"This appeal under Section 62 of the Insolvency and Bankruptcy Code, 20161 is directed against the judgment and order dated 14.05.2019 passed by the National Company Law Appellate Tribunal, New Delhi 2 in Company Appeal (AT) Insolvency No. 5"
79,west bengal,50,17,GPE,West Bengal,EVIDENCE,,1,informative,,"[1966] 3 ; Commissioner of Income Tax, West Bengal, Calcutta v. Juggilal Kamalapat,"
80,company,50,12,ORG,Company,ACTOR,,1,informative,,It appears that the Liquidators expected to wind up the affairs of the Company within a period of five months from the execution of the Sale Deed and to distribute the 1936 shares or such part thereof as remained with them after they had ex
81,clause,50,7,ORG,Clause,ACTOR,,1,informative,,"The sale deed was actually executed on 18-4-1954, and the five months period provided in Clause (5) expired on 18-9-1954."
82,lalmuni devi,50,1,PERSON,Lalmuni Devi,ACTOR,,1,informative,,"Lalmuni Devi, mother of deceased Rajendra Rai abducted ten days before the date fixed for recording her statement."
83,madras,48,14,LOC,Madras,EVIDENCE,,1,informative,,The decision in the Nagpur case was followed in Madras and it was held that the endorsement to the effect that the consignment was 'said to contain' a certain number of bags did not amount to any admission on the part of the railway adminis
84,paigah,48,1,PERSON,Paigah,ACTOR,,1,informative,,The dispute on hand relates to a Paigah granted to a person by name Khurshid Jah and the grant came to be known as Khurshid Jah Paigah.
85,ex,46,9,ORG,Ex,ACTOR,,1,informative,,The recovery memoranda is Ex. PU/1.
86,shyamala raju,46,1,PERSON,Shyamala Raju,ACTOR,,1,informative,,"At the relevant time, one Shyamala Raju was the cultivating tenant."
87,evacuee,46,1,ORG,Evacuee,ACTOR,,1,informative,,"In the villages which were wholly inhabited by Muslims and from which almost the entire population migrated to Pakistan, all the Shamlat-deh lands together with the other proprietary lands were declared evacuee property and came to be veste"
88,khurshid jah,46,1,PERSON,Khurshid Jah,ACTOR,,1,informative,,The dispute on hand relates to a Paigah granted to a person by name Khurshid Jah and the grant came to be known as Khurshid Jah Paigah.
89,chief justice,45,6,ORG,Chief Justice,ACTOR,,1,informative,,"Gram Panchayat Of Village, Jamalpur vs Malwinder Singh & on 9 July, 1985 CHINNAPPA REDDY, J. I agree with the conclusion of my lord the Chief Justice and I reiterate the proposition that the assent accorded by the President for the express "
90,npp,45,1,ORG,Npp,ACTOR,,1,informative,,"The incidents occurred in Three Miles Island Power Plant USA, Chernobyl, Ukraine, USSR, Fukoshima, Japan, Union Carbide, Bhopal might be haunting the memory of the people living in and around Kudankulam, leading to large-scale agitation and"
91,bombay,44,20,GPE,Bombay,EVIDENCE,,1,informative,,The GSFC resented the fact that discount was not given to them as bulk purchasers and that the prices charged for the Trombay fertiliser factory and power house at Bombay were substantially lower than the prices that the ONGC charged them.
92,limitation act,44,3,EVENT,Limitation Act,PROCEDURAL,PROCEDURE-REMEDY,1,informative,,"This question has never been conclusively decided and even if one is to proceed on the basis that Shyamala Raju was a tenant of K.S. Setlur, will the tenant's possession be taken into account in calculating the period of twelve years under "
93,bhagwandas,44,1,GPE,Bhagwandas,EVIDENCE,,1,informative,,"Ramadhar Shrivas vs Bhagwandas on 27 October, 2005 JAB LJ 1, , (2006) 1 ALL WC 150, , (2006) 62 ALL LR 360, (2005) 4 REC CIV R 793, (2006) 1 ICC 761, (2005) 2 REN CR 584, (2006) 1 CIVIL COURT CASE 450, , , (2005) 8 SUPREME 8, (2006) 37"
94,mathruka,44,1,PERSON,Mathruka,ACTOR,,1,informative,,"In Para 2 of the General Orders of the Farman, he directed that “whatever property had hitherto been acquired or articles purchased or buildings constructed out of the income of the Paigahs will be considered the property of the Paigahs and"
95,rs,43,16,PERSON,Rs,ACTOR,,1,informative,,"44.448.20 debited to the account of 'wire and strip' and credited to the 'wire and strip Gift Account' and Rs. 30,000 debited to the account of 'Semi-processed needles' and credited to the 'Semi-processed Needles Gift Account'."
96,cpc,43,8,ORG,Cpc,ACTOR,,1,informative,,"This civil appeal arises out of judgment and decree rendered by Karnataka High Court on 22.3.1999 filed under section 96 CPC against judgment and decree dated 11.10.1996 passed in O.S. No. 3656/81 on the file of City Civil Judge, Bangalore,"
97,hyderabad,42,6,GPE,Hyderabad,EVIDENCE,,1,informative,,"The appellants were appointed trustees by the Nizam of Hyderabad by a trust deed executed on Tune 14, 1951."
98,central act,42,4,LAW,Central Act,RULE,,1,informative,,"As a result of this provision the interest of all evacuees which had vested in the Custodian appointed under the Punjab Act 14 of 1947, came to be vested in the Custodian appointed under the Central Act of 1950."
99,veer gurjar aluminium industries pvt,42,1,ORG,Veer Gurjar Aluminium Industries Pvt,,,0,non-informative,,"Babulal Vardharji Gurjar vs Veer Gurjar Aluminium Industries Pvt ... on 14 August, 2020"
100,jammu,41,5,GPE,Jammu,EVIDENCE,,1,informative,,"R.D. Shetty v. The International Airport Authority of India JUDGMENT: State of Jammu and Kashmir & , [1980] 3 ; Fertilizer Corporation Kamagar Union v. Union of India, ; Ram and Shyam Company v. State of Haryana & ,"
101,harendra rai,41,1,PERSON,Harendra Rai,ACTOR,,1,informative,,"Harendra Rai vs The State Of Bihar on 18 August, 2023"
102,legislature,40,14,ORG,Legislature,ACTOR,,1,informative,,That assent can not avail the State Government for the purpose of according precedence to the law made by the Legislature namely the Punjab Act of 1953 over the law made by the Parliament namely the Central Act of 1950 even within the juris
103,punjab act,40,1,LAW,Punjab Act,RULE,,1,informative,,The Punjab Act was reserved for the assent of the President though for the specific and limited purpose of Articles 31 and 31-A of the Constitution.
104,wage board,40,1,ORG,Wage Board,ACTOR,,1,informative,,On issue No. IA the Tribunal held that categorisation of workers and their fitments and work load should be in accordance with the recommendations of the Wage Board; it decided in favour of the management in respect of certain categories of
105,central electricity regulatory,40,1,ORG,Central Electricity Regulatory,ACTOR,,1,informative,,"Energy Watchdog vs Central Electricity Regulatory ... on 11 April, 2017 WC 2692, (2017) 3 CAL HN 146, (2017) 2 CURCC 178,"
106,harjit,39,1,ORG,Harjit,ACTOR,,1,informative,,Harjit Singh
107,energy watchdog,39,1,ORG,Energy Watchdog,ACTOR,,1,informative,,"Energy Watchdog vs Central Electricity Regulatory ... on 11 April, 2017 WC 2692, (2017) 3 CAL HN 146, (2017) 2 CURCC 178,"
108,kudankulam,39,1,ORG,Kudankulam,ACTOR,,1,informative,,"We are in these appeals concerned with an issue of considerable national and international importance, pertaining to the setting up of a nuclear power plant in the South-Eastern tip of India, at Kudankulam in the State of Tamil Nadu."
109,patna,38,9,GPE,Patna,EVIDENCE,,1,informative,,This appeal by special leave is from a judgment and order of the High Court of Patna upholding the conviction of the two appellants under s. 420 I.P.C. read with S. 34 but reducing the sentence of imprisonment on each of them by awarding ri
110,muslim,38,5,NORP,Muslim,ACTOR,,1,informative,,"There were some villages in Punjab which were mostly inhabited by Muslims, with the result that almost all the lands in those villages were owned by Muslim proprietors who, as a result of their proprietary interest in those Lands had a prop"
111,insurance company,38,3,ORG,Insurance Company,ACTOR,,1,informative,,"No doubt, it would have been better if the Bank and the insured had given at least one tripartite agreement to the Insurance Company but, in our view, in the peculiar facts of this case, not disclosing the tripartite agreement or the names "
112,article 16,38,2,LAW,Article 16,RULE,CONSTITUTIONAL,1,informative,,Reservation set out under Article 16 should not exceed the limit of 50%.
