rank,entity,count,doc_freq,ent_type,std_name,role,topic,nonambiguous,informative,notes,example
2265,syed jaffer imam,2,2,PERSON,Syed Jaffer Imam,ACTOR,,1,informative,,"And on 24 January, 1963 Author: N. Rajagopala Ayyangar Bench: N. Rajagopala Ayyangar, Syed Jaffer Imam, J.R. Mudholkar SHANKARLAL AGGARWAL AND"
2266,evans,2,2,PERSON,Evans,ACTOR,,1,informative,,"In Hirschorn v. Evans (Barclays Bank Ltd., Garnishees), 1938 (2) KB 801(L) a joint deposit account was opened by A and B (who were husband and wife) and the bank was authorized to accept the signature of either A or B or of the survivor as "
2267,banks,2,2,PERSON,Banks,ACTOR,,1,informative,,"We have our doubts regarding the validity of the order of the Trial Court allowing the Banks ""information"" application."
2268,bilaspur,2,2,PERSON,Bilaspur,ACTOR,,1,informative,,"The judgment-debtor appealed against the order dismissing the application and on May 1, 1952, the Additional District judge, Bilaspur, set-aside the sale, and possession of the property was restored to the appellant."
2269,s. 49,2,2,PERSON,S. 49,ACTOR,,1,informative,,"This was provided by s. 49 of the Act which, in so far as relevant to the present purpose, read as follows :- ""49, (1) A proprietor, who temporarily or permanently loses, whether under a decree or 194."
2270,uj(sc,2,2,WORK_OF_ART,Uj(Sc,,,0,non-informative,,"L. J. 1509, (1987) 100 MAD LW 59, 1987 (1) UJ (SC) 23, 1987 UJ(SC) 1 23, 1987 SCFBRC 41, 1987 MPRCJ 1, (SC), (1986) 12 ALL LR 660, (1987) 1 ALL RENTCAS 6, , (1986)"
2271,no.4,2,2,ORG,No.4,ACTOR,,1,informative,,Thereafter respondent no.4 allotted the first floor of the house to the appellant by his order dt.
2272,babu,2,2,GPE,Babu,EVIDENCE,,1,informative,,"The scope and purpose of sec. 17(2) of the Act was considered by this Court in Babu Singh Chauhan v. Rajkumar Jain & , [1982] 3 and the Court observed: ""A perusal of this statutory provision would clearly disclose that the object of the Act"
2273,that:-,2,2,ORG,That:-,ACTOR,,1,informative,,"286 (1)(b), which provides that:- "" No law of a State shall impose or authorise the imposition of, a tax on the sale or purchase of goods where such sale or purchase takes place in the course of the......... export of goods out of, the terr"
2274,k.k. venugopal,2,2,PERSON,K.K. Venugopal,ACTOR,,1,informative,,"Etc vs The State Of Tamil Nadu & Others on 9 January, 1973 K.K. Venugopal and K. B. Nambiyar, for the appellants in C.As."
2275,time,2,2,ORG,Time,,,0,non-informative,,"Time was sought to file counter-affidavit, which was granted."
2276,curtis,2,2,PERSON,Curtis,ACTOR,,1,informative,,"Curtis, for one, has contended that consistently with the ascertained meaning of the statute, a court should be able to shake off the dust of the past plant its feet firmly in the present. ....."
2277,l&s,2,2,ORG,L&S,,,0,non-informative,,"MAD LJ 132, (2004) 1 SCT 788, (2004) 1 SUPREME 471, , 2004 (L&S) 363, (2004) 100 FACLR 1029, (2004) 1 LAB LN 462, (2004) 1 ESC 168, (2004)"
2278,kuldeep singh,2,2,PERSON,Kuldeep Singh,ACTOR,,1,informative,,"the view taken in the above decision and in Superintending Engineer, Public Health, U.T. Chandigarh and Others Vs. Kuldeep Singh and Others [ ] cannot be said to be correct as Article 16(4) confers a discretion and does not confer any const"
2279,constable,2,2,PERSON,Constable,ACTOR,,1,informative,,"In this connection reference may be made Union Of India And vs S.B. Vohra And on 5 January, 2004 to the case of Chief Constable of the North Wales Police v. Evans where it was said that: (p. 144 a) ""The purpose of judicial review is to ensu"
2280,court of appeals,2,2,ORG,Court Of Appeals,ACTOR,,1,informative,,"[2000] 2 WLR 622, CA the Court of Appeals held that a health authority which promised a small number of residents in a care home for the severely disabled that it would be their home for life was not entitled to frustrate the legitimate exp"
2281,uk,2,2,GPE,Uk,EVIDENCE,,1,informative,,"In his recent book 'Constitutional Reform in the UK' at page 105, Dawn Oliver commented thus: ""However, this concept of democracy as rightsbased with limited governmental power, and in particular of the role of the courts in a democracy, ca"
2282,hl,2,2,ORG,Hl,ACTOR,,1,informative,,"The case of Bromley London Borough Council v. Greater London Council ([1983] 1 AC 768, HL) is a classic example."
2283,division,2,2,ORG,Division,ACTOR,,1,informative,,"Ramesh Chand Paliwal and Another [ ], a Division bench of this Court inter alia held that the Chief Justice has the requisite power to revise the scales of pay subject of course to the approval granted in this behalf by the Governor."
2284,mukherjee,2,2,FAC,Mukherjee,EVIDENCE,,1,informative,,### Appeal (civil)#Appeal (civil) 9131 of 2003#2003#Rekha Mukherjee #Ashish Kumar Das & #2003-11-18#25651# 9131#CJI# S.B. Sinha # Dr. AR.
2285,court of sessions,2,2,ORG,Court Of Sessions,ACTOR,,1,informative,,"After completion of investigation the police submitted a chargesheet against all the 24 accused in the Court of Judicial Magistrate, Kanchipuram on 21.1.2005, which was registered as Preliminary Registered Case (PRC) No. 2 of 2005 and commi"
2286,krishna kumar,2,2,PERSON,Krishna Kumar,ACTOR,,1,informative,,"Shri K.S. Dinakaran, in his letter dated 23.9.2005 sent to Shri Krishna Kumar, Advocate on Record for the petitioner in the Supreme Court (copy of which has been placed on record), has mentioned that the said incident did take place in the "
2287,section 164 cr,2,2,LAW,Section 164 Cr,RULE,,1,informative,,"It is noteworthy to mention here that in his confessional statement, which was recorded under Section 164 Cr.P.C. on 31.12.2004 before the Chief Judicial Magistrate, Chenglepet, Ravi Subramaniam had stated that his relations with his wife w"
2288,income tax appellate tribunal,2,2,ORG,Income Tax Appellate Tribunal,ACTOR,,1,informative,,"The respondent-assessee having failed before the Income Tax Officer and the Appellate Assistant Commissioner, appealed to the Income Tax Appellate Tribunal and contended that the first company was carrying on the business of banking and hen"
2289,revenue,2,2,ORG,Revenue,ACTOR,REVENUE-TENURE,1,informative,,"Allowing the appeal by the Revenue, this Court, HELD:"
2290,section 5 of limitation act,2,2,LAW,Section 5 Of Limitation Act,RULE,PROCEDURE-REMEDY,1,informative,,But there is a basic difference between Section 5 of Limitation Act and Section 473 of the Code.
2291,limitation,2,2,EVENT,Limitation,PROCEDURAL,PROCEDURE-REMEDY,1,informative,,"6.The general rule of Limitation is based on the maxim vigilantibus, et non dormientibus, jura subveniunt (the vigilant and not the sleepy, are assisted by the laws)."
2292,pradesh high court,2,2,ORG,Pradesh High Court,ACTOR,,1,informative,,From the Judgment and order dated 27.4.1992 of the Andhra Pradesh High Court in Crl.
2293,sub-divisional magistrate,2,2,ORG,Sub-Divisional Magistrate,ACTOR,,1,informative,,It is also provided under section 55 that no court shall take cognizance of any case which is cognizable under the Act by the Panchayati Adalat unless an 'Order has been passed by a Sub-Divisional Magistrate under section.
2294,heydon,2,2,GPE,Heydon,EVIDENCE,,1,informative,,"And on 19 September, 1977 facie preference, the real object of interpretation being to find out the true instant of the law maker and that can be done only by reading the statute as an organic whole, with each part throwing light on the oth"
2295,lok sabha,2,2,PERSON,Lok Sabha,ACTOR,,1,informative,,"He would be displaced from his original home where he might have spent a major part of his life and he might have to maintain two establishments involving him in considerable extra expenditure; This was in fact admitted by Shri Asoke Sen, t"
2296,v.s,2,2,ORG,V.S,ACTOR,,1,informative,,v. V.S. (1956) 352 U.S. 128
2297,cardozo,2,2,PERSON,Cardozo,ACTOR,,1,informative,,"The difficulty of gathering the true intent of the law giver from the words used in the statute was expressed by Holmes, J., in a striking and epigrammatic fashion when he said: ""Ideas are not often hard but the words are the devil"" and thi"
2298,rob,2,2,PERSON,Rob,ACTOR,,1,informative,,"It was, however, contended on behalf of the Government that this narrow interpretation of the provision in Clause (1) of Article 222 permitting transfer only with consent would stultify the power of transfer conferred on the President and r"
2299,welfare state,2,2,ORG,Welfare State,ACTOR,,1,informative,,"We have not the slightest doubt that, having regard to the enormous undertakings a Welfare State, such as is envisioned in our Constitution, has to launch upon, government and government controlled institutions becomes litigants in a variet"
2300,supreme,2,2,ORG,Supreme,ACTOR,,1,informative,,"We must first understand that judges have been assigned, by the supreme lex, an independent sentinel's duty."
2301,law lexicon,2,2,ORG,Law Lexicon,ACTOR,,1,informative,,"Sfroud's Law Lexicon defines 'consultation' thus: CONSULTATION,"
2302,fletcher,2,2,PERSON,Fletcher,ACTOR,,1,informative,,"""Consultation means that, on the one side, the Minister must supply sufficient information to the local authority to enable them to tender advice, and, on the other hand, a sufficient opportunity must be given ""to the local authority to ten"
2303,national consumer disputes redressal commission,2,2,ORG,National Consumer Disputes Redressal Commission,ACTOR,,1,informative,,The appellants challenge the order of the National Consumer Disputes Redressal Commission (“the NCDRC”)1 which upheld the concurrent rejection of their application seeking relief.
2304,insurance,2,2,ORG,Insurance,ACTOR,,1,informative,,"Learned counsel also submitted that at the point of time of renewal, no implied obligation on the part of the insurer can be inferred given that each transaction signifies a fresh contract of Insurance."
2305,canara bank,2,2,GPE,Canara Bank,EVIDENCE,,1,informative,,"The general law on avoidance of a contract was explained by this court in Canara Bank v. United India Insurance Co. Ltd.8 in the following terms: ""[T]o make a contract void, the non-disclosure should be of some very material fact."
2306,new india assurance company limited,2,2,ORG,New India Assurance Company Limited,ACTOR,,1,informative,,"At the relevant time, the insured were living in both Wales and Spain and were British 12Reliance Life Insurance Co. Ltd. vs Rekhaben Nareshbhai Rathod ; Life Insurance Corporation of India vs Asha Goel ; P.C. Chacko vs Chairman, Life Insur"
2307,article 23,2,2,LAW,Article 23,RULE,CONSTITUTIONAL,1,informative,,"If, however, there had been no prior agreement on English law and jurisdiction, then I think that a straightforward proposal, in writing, which the insured was asked to read carefully, as the Sherdleys were asked to read Nordea's proposal, "
2308,article 41,2,2,LAW,Article 41,RULE,CONSTITUTIONAL,1,informative,,Article 41 imposes the duty on the state to public assistance essentially for those who are sick and disabled.
2309,insured,2,2,ORG,Insured,ACTOR,,1,informative,,"It kept the Insured in the dark about the limitation at the time when the renewal notice was issued, and what is more, the premium was accepted."
2310,single bench,2,2,LAW,Single Bench,RULE,,1,informative,,"In writ appeal, the order of the Single Bench was set aside by the Division Bench vide judgment and order dated 20.8.1997."
2311,section 169,2,2,LAW,Section 169,RULE,,1,informative,,"Section 169 of the A.P. Panchayat Raj Act, 1994 deals with creation of the posts of officers and employees of the Mandal Parishad, the method of recruitment and conditions of service."
2312,administration,2,2,ORG,Administration,ACTOR,,1,informative,,PROVISIONS AS TO THE ADMINISTRATION AND CONTROL OF SCHEDULED AREAS AND SCHEDULED TRIBES PART
2313,india &,2,2,ORG,India &,,,0,non-informative,,"However, in the context of Article 370(1) of the Constitution of India in Puranlal Lakhanpal v. President of India & , , the power is given to the President to efface effect of any provision of law altogether in its application to the State"
2314,indira,2,2,GPE,Indira,EVIDENCE,,1,informative,,"(See Indira Nehru Gandhi v. Raj Narain, 1975 Supp 1)"
2315,shambhu,2,2,NORP,Shambhu,ACTOR,,1,informative,,"By way of aside, the fluctuating fortunes of fundamental rights, when the proletarist and the proprietarist have asserted them in Court, partially provoke sociological research and hesitantly project the Cardozo thesis of sub-conscious forc"
2316,sarwan,2,2,GPE,Sarwan,EVIDENCE,,1,informative,,"In Sarwan Singh v. Kasturi Lal, , this Court opined: ( p. 760, para 20) “When two or more laws operate in the same field and each contains a non obstante clause stating that its provisions will override those of any other law, stimulating a"
2317,telugu,2,2,ORG,Telugu,ACTOR,,1,informative,,"It was further urged on behalf of respondents that the State of Andhra Pradesh was reorganised in the year 1956, and part of the areas falling in the State of Hyderabad, Telugu speaking areas known as Telangana merged with Andhra Pradesh."
2318,article 51-a,2,2,LAW,Article 51-A,RULE,CONSTITUTIONAL,1,informative,,"In this regard, it will be worthwhile to refer to Article 51-A in Part IV-A under the caption 'Fundamental Duties' added by the Constitution (Forty-second Amendment) Act, 1976, in accordance with the recommendations of the Swaran Singh Comm"
2319,house of parliament,2,2,ORG,House Of Parliament,ACTOR,,1,informative,,Article 338(6) requires that the President shall cause all such reports to be laid before each House of Parliament and a memorandum explaining action taken or proposed to be taken on recommendations relating to the Union and the reasons for
2320,union territories,2,2,ORG,Union Territories,ACTOR,,1,informative,,"The Constitution is spatially it provides Scheduled Areas under Article 244, Schedule V, Schedule VI, and special provisions have been made concerning various States under Articles 370, 371A to 371J. For better administration, the Constitut"
2321,dhawan,2,2,PERSON,Dhawan,ACTOR,,1,informative,,"Concerning classification in a constitutional dispensation for scheduled castes and scheduled tribes, Dr. Ambedkar’s speech in the Constituent Assembly Debates, page 979, 11th at pages 979−80 is referred to by Dr. Dhawan."
2322,nehru,2,2,PERSON,Nehru,ACTOR,,1,informative,,Prime Minister Nehru himself stated that the addition of the word “economically” would put the language of the article at variance with that of Article 340.
2323,technical committee,2,2,ORG,Technical Committee,ACTOR,,1,informative,,"Technical Committee constituted a SubCommittee of Experts (Appendix-20, Volume II) to help the Commission prepare ‘Indicators of Backwardness’ for analysing data contained in computerised tables."
2324,state of m.p,2,2,ORG,State Of M.P,ACTOR,,1,informative,,"For example, in State of M.P. v. Nivedita Jain admission to medical course was regulated by an entrance test (called Pre-Medical Test)."
2325,education,2,2,ORG,Education,ACTOR,,1,informative,,"Similarly, in the case of posts at the higher echelons e.g., Professors (in Education), Pilots in Indian Airlines and Air India, Scientists and Technicians in nuclear and space application, provision for reservation would not be advisable.”"
2326,general clauses act,2,2,LAW,General Clauses Act,RULE,,1,informative,,The expression ‘Local Authority’ is defined in Section 3(31) of the General Clauses Act.
2327,village panchayat,2,2,ORG,Village Panchayat,ACTOR,,1,informative,,"Therefore, the reservation in the local bodies like the Village Panchayat is not governed by Article 16(4), which speaks about the reservation in the public employment, but a separate constitutional power directs the reservation in such loc"
2328,himachal pradesh,2,2,LOC,Himachal Pradesh,EVIDENCE,,1,informative,,"Reservations in favour of OBCs are in force in the States of Kerala, Tamil Nadu, Karnataka, Andhra Pradesh, Maharashtra, Orissa, Bihar, Gujarat, Goa, Uttar Pradesh, Punjab, Haryana and Himachal Pradesh among others."
2329,all india service,2,2,ORG,All India Service,,,0,non-informative,,"For example, if a member of a designated backward class becomes a member of IAS or IPS or any other All India Service, his status is society (social status) rises; he is no longer socially disadvantaged."
2330,article 10,2,2,LAW,Article 10,RULE,CONSTITUTIONAL,1,informative,,"Therefore the seats to be reserved, if the reservation is to be consistent with sub-clause (1) of Article 10, must be confined to a minority of seats."
2331,para 6,2,2,FAC,Para 6,,,0,non-informative,,"Similar provisions are contained with respect to socially and educationally backward classes in Article 342A. Scheduled Area is defined in Para 6 of Schedule V, and the power to amend is provided in Para 7 of Schedule V. It is also provided"
2332,act of parliament,2,2,WORK_OF_ART,Act Of Parliament,,,1,informative,,The Governor can make a provision within the parameters of amendment/ modification of the Act of Parliament or State legislature.
2333,resultantly,2,2,ORG,Resultantly,ACTOR,,1,informative,,"Resultantly, we allow the appeals, and save the appointments made so far conditionally with the aforesaid riders."
2334,expert committees,2,2,PRODUCT,Expert Committees,,,1,informative,,"Along with mandating prior approval of the Central Government to undertake any non−forest activities in forests and issuing directions on the felling of trees, this Court also directed the constitution of Expert Committees by each state gov"
2335,vijay,2,2,GPE,Vijay,EVIDENCE,,1,informative,,"In the context of accountability, this Court in Vijay Rajmohan v. CBI34 has held: “34."
2336,state pollution control boards,2,2,ORG,State Pollution Control Boards,ACTOR,,1,informative,,An overview of some of the main bodies that regulate the environment in India can be encapsulated as follows: i. Central Pollution Control Board (CPCB) and State Pollution Control Boards (SPCB): These Boards were initially constituted under
2337,state government’s,2,2,ORG,State Government’S,ACTOR,,1,informative,,"The Central Government constitutes the Advisory Committee under the Forest (Conservation) Act, 1980 to advise the Central Government on the grant of approval for State Government’s use of forest land for non−forest purposes and on any other"
2338,water (prevention and control of pollution,2,2,WORK_OF_ART,Water (Prevention And Control Of Pollution,,,0,non-informative,,"The Water (Prevention and Control of Pollution) Act, 1974; (ii) The Water (Prevention and Control of Pollution)"
2339,para 12,2,2,ORG,Para 12,,,0,non-informative,,"State Pollution Control Boards62 57 , para 9. 58 , para 12."
2340,national disaster management,2,2,ORG,National Disaster Management,ACTOR,,1,informative,,National Disaster Management Authority73 xvi.
2341,state of chhattisgarh,2,2,GPE,State Of Chhattisgarh,EVIDENCE,,1,informative,,"In the bid, the Consortium indicated that the lead member, Adani Enterprises, had an arrangement for indigenous coal requirement of the project with Gujarat Mineral Development Corporation, as the said Corporation had been allotted a certai"
2342,japanese,2,2,NORP,Japanese,ACTOR,,1,informative,,A similar Memorandum of Understanding was also entered into between Adani Enterprises and a Japanese agent for supply of 3 to 5 million tons of coal again on a long term basis.
2343,chhattisgarh,2,2,GPE,Chhattisgarh,EVIDENCE,,1,informative,,"On 2nd February, 2007, a Power Purchase Agreement was entered into between GUVNL and Adani Power and this was for supply of power from a power project being set up at Korba in Chhattisgarh."
2344,state commission’s,2,2,ORG,State Commission’S,ACTOR,,1,informative,,"The State Commission’s jurisdiction is only where generation and supply takes Energy Watchdog vs Central Electricity Regulatory ... on 11 April, 2017 place within the State."
2345,non,2,2,ORG,Non,,,0,non-informative,,"As a matter of fact, clause 12.4 of the PPA, which deals with force majeure exclusions, reads as follows : “12.4 Force Majeure Exclusions Force Majeure shall not include (i) any event or circumstance which is within the reasonable control o"
2346,environmental management plan,2,2,ORG,Environmental Management Plan,ACTOR,,1,informative,,"ARTICLE 13: CHANGE IN LAW 13.1 Definitions In this Article 13, the following terms shall have the following meanings: 13.1.1 “Change in Law” means the occurrence of any of the following events after the date, which is seven (7) days prior t"
2347,coastal,2,2,ORG,Coastal,ACTOR,,1,informative,,"Others, as is the case in the Adani Haryana matter, would source fuel to the extent of 70% from India and 30% from abroad, whereas other generators, as in the case of Gujarat Adani and the Coastal case, would source coal wholly from abroad."
2348,redressal commission,2,2,ORG,Redressal Commission,ACTOR,,1,informative,,"By the said judgment, the National Commission reversed the concurrent judgments of the District Consumer Disputes Redressal Forum Reason: (for short “the District Forum”) and the State Consumer Disputes Redressal Commission (for short “the "
2349,revision petition,2,2,ORG,Revision Petition,ACTOR,PROCEDURE-REMEDY,1,informative,,"The National Commission, thus, allowed the Revision Petition."
2350,sl,2,2,PERSON,Sl,,,0,non-informative,,The guidelines read as under:- Sl.No.
2351,guest house,2,2,FAC,Guest House,EVIDENCE,,1,informative,,The Registrar General of the High Court was given direction for making arrangements of stay of Lalmuni Devi at the Judges’ Guest House at Patna so that she was isolated from any influence and that her statement was to be recorded at the Gue
2352,court of law,2,2,ORG,Court Of Law,ACTOR,,1,informative,,"According to the general procedure, facts need to be proved by adducing evidence in the Court of law, and the evidence must be produced in accordance with the procedure mentioned in the Indian Evidence Act, 1872."
2353,section 123 of the act,2,2,LAW,Section 123 Of The Act,RULE,,1,informative,,"In the case of Joseph M Puthussery vs T.S. Jhon and others6, this Court was dealing with an appeal filed under Section 5 6 116 A of the Representation of People Act, 1951, against the order of a single bench of the High Court declaring the "
2354,exh,2,2,PERSON,Exh,ACTOR,,1,informative,,"Before parting with this case, we consider it appropriate to observe that though the prosecution has to prove the case against the accused in the manner stated by it and that any act or omission on the part of the prosecution giving rise to"
2355,sessions,2,2,ORG,Sessions,ACTOR,,1,informative,,"The learned Sessions Judge probably assumed that since the statement was recorded as a FIR, it could not be treated as a dying declaration."
2356,cw1,2,2,NORP,Cw1,ACTOR,,1,informative,,"The rest of the accused, although named in the chargesheet after due investigation, since their names were not reflected either in the Fard Bayan of the deceased Rajendra Rai (dying declaration) or in the statement of CW1, therefore, their "
2357,ramasubramanian,2,2,ORG,Ramasubramanian,ACTOR,,1,informative,,"………..………………… J. (SURYA KANT) …………………………...J. (V. RAMASUBRAMANIAN) NEW DELHI DATED: 30.09.2022 Page | 17 K. Ramya vs National Insurance Company Ltd. on 30 September, 2022"
2358,ipse dixit,2,2,PERSON,Ipse Dixit,ACTOR,,1,informative,,"Except ipse dixit on the part of the Organizers and a couple of their witnesses, who said that in case of any difficulty, they used to contact Mr. Pandey, etc."
2359,no objection certificate,2,2,ORG,No Objection Certificate,ACTOR,,1,informative,,"Emboldened by the grant of the No Objection Certificate and treating the same to be an order granting permission to hold the exhibition both by the District Administration and Police Authorities, the Organizers approached the Chief Fire Off"
2360,naresh,2,2,PERSON,Naresh,ACTOR,,1,informative,,"Before the SFO submitted his joining report, Mr. Naresh Kumar Singh who was the SSFO made a purported inspection and submitted a report to the CFO evidently ignoring the procedure prescribed namely to forward the report through the SFO."
2361,sohan lal,2,2,PERSON,Sohan Lal,ACTOR,,1,informative,,"The findings in Shri Sohan Lal are not relevant in the present case as such judgment of this Court arose in respect of restoration of possession of a house, the title over which was disputed."
2362,kurian,2,2,GPE,Kurian,EVIDENCE,,1,informative,,"3678 OF 2007 J U D G M E N T KURIAN, J.: Bharat Aluminium Co vs Kaiser Aluminium Technical ..."
2363,chapter iv,2,2,LAW,Chapter Iv,RULE,,1,informative,,"For this, the High Court relied upon Entries 17A ‘Forest’ and 17B ‘Protection of wild animals and birds’ in the concurrent list and the power of the State Government to notify Sanctuaries, National Parks, Conservation Reserves and Community"
2364,nos.2,2,2,GPE,Nos.2,EVIDENCE,,1,informative,,"The exchange of hot words, it appears, led to a scuffle between the deceased and the accused persons in the course whereof, while accused Nos.2 and 3 beat the deceased with fist and kicks, the appellant hit the deceased with the iron pipe o"
2365,ministry of home affairs,2,2,ORG,Ministry Of Home Affairs,ACTOR,,1,informative,,"The said case was re-registered by the appellant as RC-03/2019/NIA/JMU on 15.04.2019, subsequent to the order dated 12.04.2019, passed by the Ministry of Home Affairs (MHA), Government of India."
2366,mha,2,2,ORG,Mha,ACTOR,,1,informative,,"The said case was re-registered by the appellant as RC-03/2019/NIA/JMU on 15.04.2019, subsequent to the order dated 12.04.2019, passed by the Ministry of Home Affairs (MHA), Government of India."
