rank,entity,count,doc_freq,ent_type,std_name,role,topic,nonambiguous,informative,notes,example
1446,trial court on 03.11.2006,4,1,ORG,Trial Court On 03.11.2006,ACTOR,,1,informative,,"It was further provided by the Division Bench that in the meantime if Lalmuni Devi appears before the Trial Court on 03.11.2006, the Court may proceed with the case but if she failed to appear on the said date, the prosecution case should n"
1447,narendra singh,4,1,GPE,Narendra Singh,EVIDENCE,,1,informative,,"The said Fard Bayan was signed by the injured Rajendra Rai, two witnesses Narendra Singh, Sanjiv Kumar Singh and by the officer in-charge, Panapur Police Station, Camp Panapur."
1448,parma rai,4,1,PERSON,Parma Rai,ACTOR,,1,informative,,"On 27.07.2006, the statement of seven witnesses were recorded as follows: PW-1 - Parma Rai;] PW-2 - Harinath Rai; PW-3 – Kedama Ram; PW-4 – Harinder Rai; PW-5 – Dinanath Bhagat; PW-6 – Smt."
1449,sudhir kumar,4,1,PERSON,Sudhir Kumar,ACTOR,,1,informative,,"PW-10 is Dr. Sudhir Kumar, who had examined the injuries of three injured and had proved the injury report which was marked as Ex.2 (Smt."
1450,standing committee,4,1,ORG,Standing Committee,ACTOR,,1,informative,,The said resolution of the Standing Committee is reproduced hereunder: “Resolution It is resolved to confirm the proceedings of the meeting of the Standing Committee held on 7th July 2009 with the following modifications.
1451,fir/bayan tahriri,4,1,EVENT,Fir/Bayan Tahriri,PROCEDURAL,CRIMINAL,1,informative,,"In the present case, considering the failure of State machinery and failure of the Trial Court to ensure a fair trial from the perspective of the victim side, the aspect of non-marking of the FIR and Bayan Tahriri as an exhibit, nonproducti"
1452,section 32 of the evidence act,4,1,LAW,Section 32 Of The Evidence Act,RULE,,1,informative,,"A dying declaration made by a person who is dead as to cause of his death or as to any of the circumstances of the transaction which resulted in his death, in cases in which cause of his death comes in question, is relevant under Section 32"
1453,k. ramya vs,4,1,ORG,K. Ramya Vs,ACTOR,,1,informative,,"K. Ramya vs National Insurance Company Ltd. on 30 September, 2022 Page | 4 B. CONTENTIONS 8."
1454,pranay,4,1,GPE,Pranay,EVIDENCE,,1,informative,,"Page | 5 of the decision of the Constitution Bench in National Insurance Co. Ltd. v Pranay Sethi.1; Finally, he contended that the computation of compensation under Section 168 of Motor Vehicles Act, 1988 (hereinafter, “The Act”) must be ‘j"
1455,business ventures,4,1,ORG,Business Ventures,ACTOR,,1,informative,,"At this stage, to facilitate our analysis, it would be pertinent to divide the income as mentioned in the audit reports into two parts – (a) Income from Business Ventures and other Investments and (b) Income from House Property and Agricult"
1456,house property,4,1,ORG,House Property,ACTOR,,1,informative,,"At this stage, to facilitate our analysis, it would be pertinent to divide the income as mentioned in the audit reports into two parts – (a) Income from Business Ventures and other Investments and (b) Income from House Property and Agricult"
1457,sfo,4,1,ORG,Sfo,ACTOR,,1,informative,,He asked the SFO to make an inquiry.
1458,inquiry commission,4,1,ORG,Inquiry Commission,ACTOR,,1,informative,,This Court did not interfere with the percentage of liability reduced to 55% by the High Court from 80% held by the Inquiry Commission in a judgment reported as DAV Managing Committee & v. Dabwali Fire Tragedy Victims Association & 19. 18 2
1459,section 144 of the code,4,1,LAW,Section 144 Of The Code,RULE,,1,informative,,"Mr. Bhushan also argued that Section 133 of the Code of Criminal Procedure does not provide for any permission, whereas the Organizers have obtained permission to organize exhibition in terms of Section 144 of the Code."
1460,bhatia international,4,1,FAC,Bhatia International,EVIDENCE,,1,informative,,"At the instance of the appellant, the Bench resolved the conflicting, if not, confusing views on the applicability of Part I of Arbitration and Conciliation Act, 1996 (hereinafter referred to as ‘Arbitration Act’) and held that “… Part I of"
1461,forest department,4,1,ORG,Forest Department,ACTOR,,1,informative,,"Specifically in the context of elephant preservation in Tamil Nadu, on 14.06.2006, the State’s Principal Chief Conservator of Forests and Chief Wildlife Warden (‘PCCF’) had requested that the private/patta lands forming the traditional move"
1462,wildlife trust of india,4,1,ORG,Wildlife Trust Of India,ACTOR,,1,informative,,"Similarly, the Ministry of Environment and Forests, Government of India, by its letter dated 11.08.2006 to the State Government of Tamil Nadu had noted that 88 elephant corridors had been identified by the Wildlife Trust of India’s book tit"
1463,exception 4 to section 300,4,1,ORG,Exception 4 To Section 300,ACTOR,,1,informative,,Dealing with the provision of Exception 4 to Section 300 this Court observed: “…..
1464,roy choudhury,4,1,PERSON,Roy Choudhury,ACTOR,,1,informative,,"The respondent instituted a suit in the Munsifs court at Alipore on March 21, 1956 when the West Bengal Premises Rent Control (Temporary Provisions) Act, 1950 was in force, seeking to evict Roy Choudhury on the ground that he was a defaulte"
1465,section 14(4,4,1,LAW,Section 14(4,,,0,non-informative,,"In the meantime, on August 21, 1956 the respondent had made an application under Section 14(4) of the 1950 Act in the suit for eviction which was pending."
1466,east punjab urban land restriction act,4,1,ORG,East Punjab Urban Land Restriction Act,ACTOR,,1,informative,,"This appeal arises out of an order dated 9th July, 2010 passed by the High Court of Punjab and Haryana at Chandigarh whereby Civil Revision Petition No.580 of 2005 filed by the appellant has been dismissed and order dated 5th November, 2004"
1467,ladakh,4,1,GPE,Ladakh,EVIDENCE,,1,informative,,"Territorial extent of laws - (1) All Central laws in Table 1 of the Fifth Schedule to this Act, on and from the appointed day, shall apply National Investigation Agency New ... vs Owais Amin @ Cherry on 17 May, 2024 in the manner as provide"
1468,mithlesh,4,1,PERSON,Mithlesh,ACTOR,,1,informative,,"Mithlesh was tried for offences punishable under Sections 216 and 412, I.P.C. The trial Court acquitted all of them."
1469,saraswatibai,4,1,GPE,Saraswatibai,EVIDENCE,,1,informative,,"Insofar as the first contention that the appellant is not responsible for the death of deceased Saraswatibai, the defence made an attempt to contend that the fire was accidental and that the appellant tried to extinguish the fire in order t"
1470,raghubar sarup,4,1,ORG,Raghubar Sarup,ACTOR,,1,informative,,"It was, however, not applied to the district of Rampur initially; but power was reserved under S. 2 to apply the whole or any provisions of the Act to Rampur as defined in the Raghubar Sarup Nawab Jamshed Ali Khan vs State Of U.P on 18 Dece"
1471,nawab jamshed ali khan,4,1,PERSON,Nawab Jamshed Ali Khan,ACTOR,,1,informative,,"It was, however, not applied to the district of Rampur initially; but power was reserved under S. 2 to apply the whole or any provisions of the Act to Rampur as defined in the Raghubar Sarup Nawab Jamshed Ali Khan vs State Of U.P on 18 Dece"
1472,waterhouse,4,1,ORG,Waterhouse,ACTOR,,1,informative,,"There are 10 Audit Firms namely Price Waterhouse (PW), Lovelock and Lewes (LL), Price Waterhouse Bangalore, Price Waterhouse & Co. Bangalore, Price Waterhouse & Co. Kolkata, Price Waterhouse Delhi, Price Waterhouse & Co. Delhi, Price Waterh"
1473,gtb,4,1,ORG,Gtb,ACTOR,,1,informative,,"Lovelock and Lewes (LL), a member firm of PwC India failed to point out the high level of NPAs, in its audit report, resulting in Global Trust Bank (GTB) being forced to merge with Oriental Bank of Commerce in 2004."
1474,indian chartered accountants,4,1,ORG,Indian Chartered Accountants,ACTOR,,1,informative,,"In addition, the Indian Chartered Accountants face various invisible/non-professional barriers like visa, citizenship and residency requirements, procedural impediments to provide services in such countries."
1475,high powered committee/group,4,1,ORG,High Powered Committee/Group,ACTOR,,1,informative,,A total and full disclosure in this regard has not been made in spite of repeated directions by the High Powered Committee/Group on the basis of directions of the Council.
1476,network a,4,1,ORG,Network A,ACTOR,,1,informative,,The networking firms in Network A and all their personnel are using the domain name identical to the name of the multinational entity in their email IDs and the same is displayed in their visiting cards.
1477,network b,4,1,ORG,Network B,ACTOR,,1,informative,,"The CA firms in Network B and all their personnel are using the domain name identical to the name of the multinational entity in their email IDs, and the same is displayed in the visiting cards."
1478,pwc network,4,1,ORG,Pwc Network,ACTOR,,1,informative,,The stand of the PwC Network (Respondents 6 to 11) is that PwC or PW is the brand owned by PwCIL registered under the laws of England limited by guarantee.
1479,nishant aggarwal’s,4,1,PERSON,Nishant Aggarwal’S,ACTOR,,1,informative,,"The reason for posting the instant matter for hearing after the disposal of Nishant Aggarwal’s case was, that the controversy arising herein, was exactly the same as was sought to be determined by this court in Nishant Aggarwal’s case ."
1480,cpwd,4,1,ORG,Cpwd,ACTOR,,1,informative,,The National Commission remanded the matter for re-consideration of compensation for escalation of cost of construction in accordance with CPWD rates.
1481,hemendranath reddy,4,1,PERSON,Hemendranath Reddy,ACTOR,,1,informative,,"We have heard Shri Gopal Sankarnarayanan, learned senior counsel appearing for one set of parties who are the appellants herein (and who claim to be the assignees of the decree), Shri B. Adinarayana Rao, Shri Chander Uday Singh, Shri Ranjit"
1482,vikar,4,1,PERSON,Vikar,ACTOR,,1,informative,,"Eventually in 1882 A.D., an award was made by Sir Salar Jung, between Asman Jah on the one side and Rashibuddin Khan’s two sons, Khurshid Jah and Vikar-ul-Umara on the other, as a result of which certain estates called Paigah Taluqas were a"
1483,jagirdars,4,1,GPE,Jagirdars,EVIDENCE,,1,informative,,"In fact, the Jagirs in Hyderabad State were neither in the nature of Zamindaries of Madras State nor of Taluqdaris of U.P. While proprietary rights vested in the Zamindars of Madras and Taluqdars of Oudh, the Jagirdars in Hyderabad were ent"
1484,nawab zafar jung,4,1,PERSON,Nawab Zafar Jung,ACTOR,,1,informative,,"Nawab Zafar Jung, under a Farman issued a few weeks after the death of Sir Khurshid Jah, was put in charge of the Khurshid Jahi Paigah as a mere supervisor and trustee to carry on the ordinary routine work and was directed to take the Nizam"
1485,paigah amir,4,1,PERSON,Paigah Amir,ACTOR,,1,informative,,"In Order III Para 9, he further directed that the precious stones, jewellery and rare articles, which, in accordance with the principles laid down in Para 2 of the Farman are the property of the Paigah from olden times, or have been purchas"
1486,khurshid jah’s,4,1,PERSON,Khurshid Jah’S,ACTOR,,1,informative,,"The Nizam stated in Order III, Para 2 that at the time of Sir Khurshid Jah’s death, his two sons Imam Jung and Zafar Jung were his only heirs, who, if alive then, would have been entitled to one half share each of third part of the gross in"
1487,h.e.h,4,1,ORG,H.E.H,,,0,non-informative,,H.E.H. the Nizam referred to another and third class of property and directed as follows:- “If there is any property left as intestate property (Mathruka) in any Paigah the distribution thereof shall also be settled by the same Committee” T
1488,mirza yar jung committee,4,1,ORG,Mirza Yar Jung Committee,ACTOR,,1,informative,,"In the said report of Mirza Yar Jung Committee, a definite finding was given that it was not proved by claimants that Nawab Khurshid Jah left any property which was not acquired or purchased out of the Paigah income within the meaning of pa"
1489,bagh,4,1,GPE,Bagh,EVIDENCE,,1,informative,,"17C. That as per written statement of the defendant No.1 Bal Raj, the defendant No.54 is in possession of the Bagh Hussain Shah Vali, which is a suit property, so, he is impleaded as a party and he is liable to pay mesne property also."
1490,plaint schedule,4,1,ORG,Plaint Schedule,ACTOR,,1,informative,,"Though the Plaint Schedule and the preliminary decree did not mention specific Survey number(s) in Hydernagar, the Receiver claimed in his report that he studied the Revenue Records/Pahani Patriks/Khasra Pahanis and found that Survey No. 14"
1491,boddu veeraswamy,4,1,ORG,Boddu Veeraswamy,ACTOR,,1,informative,,"The names of 24 persons [including Boddu Veeraswamy, Ruquia Begum, Waris Ali and Ghani Shareef] who were allegedly given Pattas prior to 1948 by the Nizam/his Revenue Secretariat were also mentioned in the said Faisal Patti."
1492,housing society ltd,4,1,ORG,Housing Society Ltd,,,0,non-informative,,"Some members of another society by name Set-win Employees Housing Cooperative Society and 33 members of Sri Satya Sai Co-operative Housing Society Ltd. filed ‰ OSA Nos.10, 11 and 20 of 1996 questioning the High Court’s order dated 28.12.199"
1493,application no.708 of,4,1,ORG,Application No.708 Of,ACTOR,,1,informative,,"In the result: M/S. Trinity Infraventures Ltd. vs M. S. Murthy on 15 June, 2023 (a) OSA NOs. 54, 56, 57, 58 of 2004 are dismissed and the common order of the learned single Judge dt.26.10.2004 in claim petitions Application No.585 of 2002, "
1494,order xxi,4,1,ORG,Order Xxi,ACTOR,,1,informative,,"Though persons obstructing 15 execution and making claims in terms of Order XXI, Rules 97 to 101 CPC are also entitled to attack the decree on the ground of fraud, such claim petitioners are obliged to make pleadings as to how fraud is born"
1495,nazim atiyat court,4,1,ORG,Nazim Atiyat Court,ACTOR,,1,informative,,The sanad dated 03.12.1877; • GOMS No.1106 dated 06.06.1959 issued by the State of Andhra Pradesh ordering an Inam Enquiry; • The orders passed by the Nazim Atiyat Court first on 11.09.1959 and then on 30.10.1968; and •
1496,inam-al-tamgha,4,1,PERSON,Inam-Al-Tamgha,ACTOR,REVENUE-TENURE,1,informative,,"Much was sought to be made, out of the finding recorded by the Nazim Atiyat Court that the lands in Hafeezpet and Hydernagar included at Serial Nos.380 and 381 in the notification as per Appendix ‘F’ to the order of Nazim Atiyat was Inam-al"
1497,sahebzadi hameedunnissa begum,4,1,PERSON,Sahebzadi Hameedunnissa Begum,ACTOR,,1,informative,,"Similarly, one Sahebzadi Hameedunnissa Begum, wife of late Nawab Ghousuddin @ Mohd."
1498,v.v.s. rao,4,1,PERSON,V.V.S. Rao,,,0,non-informative,,"But in the course of arguments, Shri V.V.S. Rao, learned senior counsel appearing for the appellants also assailed paragraph Nos. 414(c) and 414(d) of the impugned judgment."
1499,rs.81/-,4,1,PERSON,Rs.81/-,ACTOR,,1,informative,,"When the complainant enquired about the registration fee of the document, the respondent said it would amount to Rs.81/-."
1500,banian,4,1,NORP,Banian,ACTOR,,1,informative,,"The complainant took out Rs.81/- from inner pocket of his banian (vest) and gave it to respondent, who placed it in the table drawer."
1501,chepu chennaiah,4,1,PERSON,Chepu Chennaiah,ACTOR,,1,informative,,"The High Court considered the theory of the defence that the document writer had foisted a false case, from the cross examination of P.W.1 and came to the conclusion that Chepu Chennaiah had visited the room of the Public Prosecutor."
1502,election commission of india,4,1,ORG,Election Commission Of India,ACTOR,,1,informative,,"Association for Democratic Reforms,[1] People's Union for Civil Liberties (PUCL) & Another V. Union of India and Another[2], Notification issued by the Election Commission of India and the Notification of the State Election Commission, Sect"
1503,v. mohana,4,1,PERSON,V. Mohana,ACTOR,,1,informative,,"We have heard Ms. V. Mohana, learned counsel for the appellant, Mr. Subramonium Prasad, learned AAG for the State Election Commission, Mr. R. Anand Padmanabhan, learned counsel for the respondent No.1 and Mr. R. Neduamaran, learned counsel "
1504,maninder singh,4,1,PERSON,Maninder Singh,ACTOR,,1,informative,,"Regard being had to the impact it would have on the principle relating to corrupt practice in all election matters as interpretation of the words 'undue influence' due to non-disclosure of criminal antecedents leading to ""corrupt practice"" "
1505,resurgence india,4,1,LOC,Resurgence India,EVIDENCE,,1,informative,,"Thus, a candidate is bound to provide the necessary information at the time of filing nomination paper and for the said purpose, the Returning Officer can compel the candidate to furnish the relevant information and if a candidate, as has b"
1506,chapter ix-a,4,1,PERSON,Chapter Ix-A,ACTOR,,1,informative,,""" Repelling the said contention, the Court held thus: ""We do not think that the Legislature, while framing Chapter IX-A of the Code ever contemplated such a dichotomy or intended to give such a narrow meaning to the freedom of franchise ess"
1507,ro,4,1,ORG,Ro,ACTOR,,1,informative,,"The Commission has, inter alia, directed that copies of affidavits should be displayed on the notice board of RO/ARO, and in cases where offices of RO and ARO are outside the boundary of the constituency concerned, copies of affidavits shou"
1508,aro,4,1,ORG,Aro,ACTOR,,1,informative,,"The Commission has, inter alia, directed that copies of affidavits should be displayed on the notice board of RO/ARO, and in cases where offices of RO and ARO are outside the boundary of the constituency concerned, copies of affidavits shou"
1509,section 11(1)(h,4,1,LAW,Section 11(1)(H,,,0,non-informative,,"Section 11(1)(h) of the Jammu and Kashmir Houses and Shop Rent Control Act, 1966 (hereinafter referred to as “the Act”), is the relevant provision: “Section 11(1)(h) “… where the house or shop is reasonably required by the landlord either f"
1510,central service,4,1,ORG,Central Service,ACTOR,,1,informative,,"It shall not be necessary to consult the Commission in regard to the selection for appointment - (a) to a Central Service, Class I, of any Officer in the Armed Forces of the Union or any officer who is already a member of an All India Servi"
1511,sitaram,4,1,PERSON,Sitaram,ACTOR,,1,informative,,"During the relevant previous year, the family consisted of Chandoolal, Sitaram and his wife Kripa Devi, Jagat Nararn, Roop Narain, Swarup Narain, Shyam Narain and Bimal Narain who were the five sons of Chandoolal and Gopalji and Ramji, the "
1512,lakshman swaroop,4,1,ORG,Lakshman Swaroop,ACTOR,,1,informative,,"By his award dated February 3, 1965, Lakshman Swaroop stated that the aforesaid properties were ""not capable of physical division into ten shares by metes and bounds and that any practical division is that of allocation of proportionate Kal"
1513,atomic energy commission,4,1,ORG,Atomic Energy Commission,ACTOR,,1,informative,,That Act envisaged the constitution of an Atomic Energy Commission (AEC) and a Department of Atomic Energy (DAE) and both were established in the year 1954.
1514,tarapur,4,1,GPE,Tarapur,EVIDENCE,,1,informative,,Two reactors based on that design became operational in 200506 at Tarapur.
1515,russian federation,4,1,ORG,Russian Federation,ACTOR,,1,informative,,"Over and above, India has now set up two PHWRs of VVER based NPPs (2 X 1000 MWe) at Kudankulam in Tamil Nadu with the co-operation of Russian Federation which is the subject matter of this litigation."
1516,international atomic energy agency,4,1,ORG,International Atomic Energy Agency,ACTOR,,1,informative,,"International Atomic Energy Agency (IAEA) has reported that in the year 2007, there were 439 Nuclear Power Reactors in operation in the world operating in thirty one countries."
1517,dba,4,1,ORG,Dba,ACTOR,,1,informative,,"Further, it was also pointed out that the design takes care of Anticipated Operational Occurrences (AOO), Design Basis Accidents (DBA) and Beyond Design Basis Accidents (BDBA) like Station Black Out (SBO), Anticipated Transients Without Scr"
1518,united nations general assembly,4,1,ORG,United Nations General Assembly,ACTOR,,1,informative,,"The IAEA reports annually to the United Nations General Assembly and when appropriate, to the Security Council regarding non-compliance by States with their safeguards obligations as well as on matters relating to international peace and se"
1519,hiroshima,4,1,GPE,Hiroshima,EVIDENCE,,1,informative,,"v) A large-scale nuclear disaster, resulting from a nuclear weapon attack (as had happened at Hiroshima and Nagasaki) which would lead to mass casualties and destruction of large areas and property."
1520,eia notification of 1994,4,1,ORG,Eia Notification Of 1994,ACTOR,LAND-ACQUISITION,1,informative,,"Referring to explanation 8 to the EIA Notification of 1994, it was submitted that the project did not obtain all clearances including NOC from the State Pollution Control Board, which was required under the Water Act of 1974 and Air Act of "
1521,kknpp units 1,4,1,ORG,Kknpp Units 1,ACTOR,,1,informative,,"Learned counsel, therefore, pointed out that all those factors would indicate that KKNPP Units 1 and 2 required fresh environmental clearance which the project proponent did not obtain."
1522,pechiparai,4,1,LOC,Pechiparai,EVIDENCE,,1,informative,,"NPCIL had a proposal to use sea water for cooling, Pechiparai reservoir for fresh water and ground water for construction."
1523,spcb,4,1,ORG,Spcb,ACTOR,,1,informative,,"If it is certified that no increase is likely to occur in the existing pollution load due to the proposed expansion or modernization, the project proponent will not be required to seek environmental clearance, but a copy of such certificate"
1524,regional office,4,1,ORG,Regional Office,ACTOR,,1,informative,,xviii) Regional Office of the Ministry of Environment & Forests located at Bangalore will monitor the implementation of the stipulated conditions.
1525,stockholm conference,4,1,ORG,Stockholm Conference,ACTOR,,1,informative,,Stockholm Conference not only brought into focus the human rights approach to the problem of environmental protection but also recognized the linkage between the development and environment from which the concept of “sustainable development
1526,rio conference,4,1,ORG,Rio Conference,ACTOR,,1,informative,,The Rio Conference also high-lighted the principle of inter generational equity.
1527,convention,4,1,EVENT,Convention,PROCEDURAL,,1,informative,,India is a signatory to the said Convention.
1528,article 61,4,1,LAW,Article 61,RULE,CONSTITUTIONAL,1,informative,,"The Appellate Tribunal has assigned another reason that mortgage security having been provided by the corporate debtor, the limitation period of twelve years is available for the claim made by the financial creditor as per Article 61 (b) of"
1529,b. k. educational services,4,1,ORG,B. K. Educational Services,ACTOR,,1,informative,,"In paragraph 15 of the impugned order, the Appellate Tribunal referred to the decision of this Court in the case of B. K. Educational Services as also Section 238-A of the Code to notice that law of limitation is applicable to the applicati"
1530,‘corporate debtor’,4,1,LAW,‘Corporate Debtor’,RULE,,1,informative,,"Though we have held that the law of limitation for filing a suit (First Division) or Appeals (Second Division) or application under Part I (Third division) are not applicable, the ‘Corporate Debtor’ can take a plea that ‘debt’ is not due, a"
1531,irp,4,1,ORG,Irp,ACTOR,,1,informative,,"Assailing the orders so passed by NCLAT and asserting that the application made by the respondent No. 2 is barred by limitation, the erstwhile director of the corporate debtor has preferred this appeal which has been duly opposed by the app"
1532,k. sashidhar,4,1,PERSON,K. Sashidhar,ACTOR,,1,informative,,"The learned senior counsel has further referred to the decision in K. Sashidhar v. Indian Overseas Bank: 2019 Online SC 25721 and has submitted that therein, this Court has reaffirmed the position that right to sue under the Code accrues on"
1533,section 3(12,4,1,LAW,Section 3(12,,,0,non-informative,,"The learned counsel would submit that in Vashdeo R.Bhojwani , this Court has taken the date of default to be that of 22 Now reported in 23 Now reported in issuance of Recovery Certificate and in Gaurav Hargovindbai Dave , this Court has tak"
1534,article 62 of the limitation act,4,1,LAW,Article 62 Of The Limitation Act,RULE,CONSTITUTIONAL,1,informative,,"The Adjudicating Authority applied Article 62 of the Limitation Act and reached to the conclusion that since the limitation period was twelve years from the date on which money sued has become due, the claim was within limitation and hence,"
1535,sagar sharma,4,1,PERSON,Sagar Sharma,ACTOR,,1,informative,,"Close on the heels of Gaurav Hargovindbhai Dave , this Court dealt with similar issue yet again in the case of Sagar Sharma , decided on 30.09.2019."
1536,rs.10 per sq.m,4,1,GPE,Rs.10 Per Sq.M,EVIDENCE,,1,informative,,"Ex. 15 - relating to acquisition of lands for ONGC, in the neighbouring Santhal village under preliminary notification dated 6.1.1987, wherein compensation at the G.M., Oil & Natural Gas Corporation Ltd vs Rameshbhai Jivanbhai Patel & on 31"
1537,section 23(1a,4,1,LAW,Section 23(1A,,,0,non-informative,,The Reference Court also awarded additional compensation under section 23(1A) and solatium under section 23(2) of the Act.
